nama_rumah,harga,lb,lt,kt,km,grs,tingkat_harga
Dijual Rumah Cantik Minimalis Di Tebet Dekat Taman,3000,150,95,4,4,1,Murah
Rumah Murah Siap Huni Akses 2 Mobil Tebet Timur Jak Sel,4100,180,155,4,3,1,Menengah
Rumah Strategis Cocok Untuk Usaha Posisi Huk Di Tebet Timur,6500,130,160,4,1,2,Mahal
Rumah Murah Akses Mobil Di Tebet Barat Jak Sel,1800,90,100,2,1,0,Murah
Rumah Strategis Siap Huni Akses 1mobil Di Tebet Barat,3500,150,135,4,3,1,Menengah
Rumah Siap Huni Hanya 50meter Ke Jalan Asembaris Raya,2100,100,126,2,2,1,Murah
Rumah 2lantai Strategis Akses 2mobil Lokasi Asembaris Tebet,3000,200,125,2,2,1,Murah
Rumah Asri Siap Huni Strategis Lokasi Asembaris Bebas Banjir,2150,128,135,3,2,1,Murah
"Rumah Baru 2,5 Lantai Akses 1mobil Lokasi Tebet Timur",3000,200,90,3,2,2,Murah
Rumah Bagus Siap Huni Tebet Barat Jak Sel,3250,120,104,4,3,1,Murah
Rumah Sederhana Di Tebet Timur Jak Sel,1750,85,90,2,1,1,Murah
Rumah Murah Sekali Siap Huni Akses Gg 2 Motor Di Lap Roos Tebet,1500,200,170,7,2,0,Murah
Rumah Siap Huni Ada Kosan 4pintu Lokasi Tebet Barat Jak Sel,3800,200,145,8,8,1,Menengah
Rumah Strategis Siap Huni Akses 1mobil Dekat Pasar Tebet Jak Sel,2500,120,100,3,2,1,Murah
Rumah Lama Layak Huni Akses 2 Mbl Bs Utk Kosan Di Menteng Dlm Jak Sel,4200,250,206,5,4,1,Menengah
Rumah Siap Huni Akses 2mobil Strategis Di Asembaris Tebet,1100,70,70,2,1,0,Murah
Rumah Siap Huni 2lantai Akses 1mobil Di Asembaris Tebet,950,100,60,3,1,0,Murah
Rumah Baru Siap Huni Akses 2mobil Semi Furnised Lokasi Tebet Utara,4500,128,90,3,3,1,Menengah
Rumah Siap Huni Posisi Huk Akses 2mobil 200meter Kejalan Supomo,7000,150,110,4,3,1,Mahal
Rumah 2lantai Akses 2mobil Di Bukit Duri Tebet Jaksel,600,60,30,2,2,0,Murah
Rumah Strategis 100meter Ke Jl Supomo Di Menteng Dalam Tebet Jak Sel,2600,100,140,3,2,1,Murah
Rumah Strategis Akses Jalan 2mobil Di Menteng Dalam Tebet Jak Sel,9000,450,550,10,10,3,Mahal
Tebet Rumah Siap Huni Jln 2 Mbl Nyaman,4000,160,140,4,3,2,Menengah
"Di Kebun Baru Rumah Terawat, Area Strategis",4000,139,230,4,4,1,Menengah
Dijual Cepat Rumah Komp Depkeu Dr Soepomo Tebet Jakarta Selatan,19000,360,606,7,4,0,Mahal
Dijual Rumah Kokoh Di Gudang Peluru,10500,420,430,7,4,2,Mahal
