nama_rumah,harga,lb,lt,kt,km,grs,tingkat_harga
Rumah Model Minimalis jalan Lebar,16000,500,420,4,4,4,Mahal
Tebet Dalam Rumah Siap Huni Dalam Komplek,13000,380,312,4,3,2,Mahal
Rumah Siap Huni Dijual Jalan 2 Mobil,7000,180,283,4,3,2,Mahal
"4 Bedrooms House Tebet, Jakarta Selatan, DKI Jakarta",2800,250,90,4,3,2,Murah
"3 Bedrooms House Tebet, Jakarta Selatan, DKI Jakarta",1850,80,90,3,2,0,Murah
Dijual Rumah Tebet Timur Raya Depan Taman Honda,20999,613,613,9,4,2,Mahal
Dijual Rumah Tebet Lokasi Strategis Nyaman Depan Taman Jalan 1 Mobil,4300,117,205,4,3,3,Menengah
Dijual Rumah Tebet Timur Lokasi Premium Nyaman Jalan 2 Mobil,4300,200,145,3,3,2,Menengah
Dijual Rumah Hitung Tanah Asem Baris Raya Lokasi Strategis Aman Jalan Raya,5500,300,266,6,4,4,Mahal
Jual Rumah Di Tebet Jakarta Selatan,9000,470,353,9,6,3,Mahal
"Rumah Bagus Akses Jalan 2 Mobil TERMURAH di Tebet Utara, Jaksel",3500,190,100,5,4,2,Menengah
"Rumah Megah SIAP HUNI TERMURAH di Tebet Timur, Jakarta Selatan",12999,400,429,9,5,5,Mahal
Rumah Siap Huni Di Asem Baris Kebon Baru Tebet Jakarta Selatan,2300,160,135,4,3,1,Murah
Tebet rumah dijual jalan 2 mobil lebar lokasi strategis,7100,200,256,5,3,3,Mahal
"Rumah Cantik, Asri Dan Nyaman Tebet Utara",7000,350,180,3,3,0,Mahal
Rumah Bagus Murah Sekali Cocok Utk Tempat Tinggal Dan Kost2an Tebet,1500,200,170,7,2,0,Murah
"Kb. Baru, Tebet, Kota Jakarta Selatan, Daerah Khusus Ibukota Jakarta 12830, Indonesia",1500,100,80,4,2,0,Murah
Rumah Sederhana Siap Huni Lokasi Strategis Tebet Barat Jaksel,3500,150,135,4,2,0,Menengah
Rumah Siap Huni 2lantai Akses 2mbl Lokasi Tebet Barat,4000,150,100,3,3,1,Menengah
Rumah Siap Huni Akses jalan 2 mobil di asem baris tebet,4000,144,126,4,2,3,Menengah
Dijual rumah tua perlu renovasi akses jalan 2mobil lokasi dekat lapangsn bola pspt,3750,150,135,3,2,1,Menengah
Rumah Bagus Siap Huni Di Tebet Timur Dalam Jak Sel,4000,150,140,4,2,2,Menengah
Rumah Mewah 3 Lantai Jalan Swadaya I Tebet ( FA),6000,450,260,7,4,1,Mahal
"Rumah Baru 2 Lt Dekat Taman dan Pasar Tebet Barat PALING MURAH di Tebet Barat, Jakarta",2550,150,90,4,4,2,Murah
Dijual Rumah Second Strategis Tanah Luas di Tebet,23000,350,565,5,3,4,Mahal
Rumah Clasic Asem Baris Tebet Jakarta Selatan Hitung Tanah Saja Setrategis Dekat Mt Haryono,9200,650,695,9,6,1,Mahal
Rumah lama hitung Tanah di Tebet,7500,180,253,3,2,1,Mahal
Rumah Tebet Hitung Tanah,14250,350,393,5,4,1,Mahal
Brand New House Di Lokasi Iconic Tebet,4000,216,135,5,4,2,Menengah
Tebet Rumah Minimalis,5850,220,138,4,3,2,Mahal
Rumah Minimalis Bagus Tebet Timur,2700,160,90,3,3,1,Murah
Dijual Rumah Tebet Hitung Tanah Lokasi Strategis Jalan 1 Mobil,3250,200,157,7,3,1,Murah
Rumah tebet jalan lebar nyaman keamanan 24 jam dekat kemana mana,9800,350,247,4,3,2,Mahal
Dijual Rumah Asri Komplek Tebet Mas Lokasi Premium Nyaman Jalan 2 Mobil,12000,350,237,4,3,2,Mahal
Rumah dijual di Tebet Raya,18500,300,520,5,4,2,Mahal
"Rumah Mewah Di Tebet Turun Harga Menjadi Rp 14,5 M, Ada Swimmung Pool",14500,500,307,10,7,2,Mahal
Rumah Di Jual Di Tebet,8200,300,260,4,4,3,Mahal
"Rumah Di Jual, Brand New, Tebet Barat ",2700,120,92,3,3,2,Murah
"Dijual Rumah minimalis di Bukit Duri, Tebet",2500,121,100,3,2,2,Murah
"Rumah Hoek Tebet Jakarta Mewah, Lokasi Strategis Selangkah ke Masjid",9900,350,250,5,3,2,Mahal
"Rumah Tebet Jakarta Selatan, depan Lapangan, Dijual Cepat Harga BU",4200,285,160,5,6,1,Menengah
Rumah Di Tengah Pusat Bisnis Dekat Jalan Gatot Subroto Jaksel,10000,353,535,10,10,7,Mahal
Rumah Dalam Komplek Di Gudang Peluru - Tebet Blok N348,5000,220,217,3,3,1,Menengah
"Tebet, Siap Huni, jalan 2 mobil",4300,250,90,4,4,2,Menengah
Rumah 2 Lantai Lokasi Strategis Akses 2 Mbl Asem Baris Tebet,3000,250,125,3,2,1,Murah
Rumah Lama Layak Huni Akses 2 Mbl Lapangan Ros Tebet Jaksel,3000,130,170,4,3,1,Murah
Rumah Baru Design Modern Posisi Hook Lokasi Tebet Timur,3400,170,110,4,4,2,Menengah
rumah baru 2lantai siap huni akses jalan 1mobil lokasi tebet timur,3200,150,90,3,2,1,Murah
Rumah Siap Huni Akses 1mobil Lokasi Tebet Timur,3000,150,110,4,3,2,Murah
Rumah Baru Siap Huni Semi Furnish Akses 1mobil Lokasi Tebet Utara,3200,210,91,5,3,1,Murah
Dijual rumah baru Lokasi tbt timur,3300,150,90,3,2,1,Menengah
"Rumah Siap Huni Di Tebet, Lingkungan Nyaman",5700,250,190,4,3,1,Mahal
Rumah Siap Huni Di Kebon Baru Jaksel,2100,188,125,6,4,1,Murah
Di jual Rumah di tebet,4000,89,175,3,3,2,Menengah
good house at jaksel tebet,2200,120,220,5,3,1,Murah
goood house at jakarta selatan tebet,8500,234,300,5,4,1,Mahal
good house at jakarta selatan tebet ,1700,154,204,5,2,0,Murah
Jual Cepat Rumah Di Tebet,10500,350,247,5,5,3,Mahal
Rumah Tebet Dekat Mall Kokas BU Harga Covid,1899,150,135,4,2,1,Murah
good house at tebet,1500,90,121,3,2,0,Murah
Rumah Tebet Barat Dalam Jakarta Selatan,9000,399,384,3,3,1,Mahal
Dijual Termurah Rumah Siap Huni di Tebet Utara Jakarta Selatan,3500,180,100,5,4,1,Menengah
TEBET MAS Rumah Nyaman Dalam Komplek Elit Dekat Taman JARANG ADA,13000,250,322,4,3,2,Mahal
"Dijual Rumah di Tebet Utara, akses 2 mobil, Jakarta Selatan",7800,160,261,3,4,2,Mahal
Dijual Rumah Tebet Barat Lokasi Premium Tenang Jalan Lebar,8000,200,202,5,3,3,Mahal
Dijual Murah Rumah Mewah di Tebet Utara Jakarta Selatan,8000,450,306,5,4,1,Mahal
Rumah Lama Layak Huni Tebet Jak Sel,2900,90,135,2,1,1,Murah
Dijual rumah lama layak huni akses jalan lebar lokasi tebet timur,2950,125,135,2,1,0,Murah
Rumah Tua Butuh Renovasi di Tebet Timur Jak Sel,2600,80,130,2,1,0,Murah
Rumah Siap Huni Baru Renovasi Di Tebet Utara Jak Sel,2500,105,54,3,2,1,Murah
Di jual rumah 2nd siap huni akses gg motor tebet,2500,100,130,3,2,0,Murah
Rumah Siap Huni Model Minimalis Di Tebet Jakarta Selatan,2600,180,95,4,2,1,Murah
TEBET - Bagus Untuk Investasi di Jalan 1 Mobil,2700,120,142,3,2,1,Murah
Rumah di Tebet Jalan dua mobil bangunan lama,5000,100,220,2,1,0,Menengah
Rumah dijual di Tebet,5900,340,134,5,4,3,Mahal
Rumah huk di Tebet jalan satu mobil lebar,3000,250,150,3,3,2,Murah
Rumah baru di Tebet Barat dekat jalan dua mobil,3500,160,118,4,4,2,Menengah
Rumah di Tebet Barat bagus terawat dekat fasum,3200,128,138,3,2,1,Murah
"TEBET - Siap Huni, Bagus, Akses 2 Mobil",5300,200,145,3,3,2,Mahal
"TEBET - Depan Taman, Baru, Jalan 2 Mobil",6500,220,150,3,3,1,Mahal
Jual Cepat Rumah Di Casablanca Jakarta Selatan,6000,300,284,7,3,3,Mahal
"Rumah Baru dijual di Tebet Barat, lokasi strategis",3500,200,135,3,3,2,Menengah
"Dijual Rumah Di Jl. Kebon Baru Utara, Tebet Jakarta Selatan",2780,192,120,5,4,2,Murah
For Sale..Rumah Di Tebet Timur,4900,215,135,9,8,0,Menengah
Rumah baru 100% bergaya mewah tebet Jakarta selatan,3800,160,165,4,3,1,Menengah
Dijual Rumah Baru Dengan Design Minimalis Di Tebet,4500,175,125,3,3,2,Menengah
"Dijual Rumah Brand New, Ada Taman, Lingkungan Tenang Di Tebet Barat",6500,350,230,4,4,2,Mahal
Dijual Rumah Dalam Komplek Elit Tebet Mas Lokasi Paling Premium di Tebet,5500,300,140,3,3,2,Mahal
"Dijual Rumah di Tebet Utara, akses 2 mobil",7800,160,261,3,4,2,Mahal
TERJUAL Rumah Di Bukit Duri Area Komersil,3900,150,250,4,2,2,Menengah
DIJUAL CEPAT HARGA MURAH ( BU CEPAT) Rumah 700 m2 Di TEBET,9200,450,700,8,4,4,Mahal
Dijual rumah siap huni 2lantai full strategis dekat kokas akes jalan2mobil lokasi menteng dalam,2200,150,82,5,2,2,Murah
Rumah Siap Huni Hanya 50m Dari Dan Ke Asem Baris Raya Tebet,2100,100,126,2,2,1,Murah
Rumah Siap Huni Akses 1mobil Di Tebet Timur,2450,150,135,5,2,0,Murah
Rumah Bagus Siap Huni Pinggir Jalan 2 Mbl Asem Baris Tebet,2150,120,135,3,2,1,Murah
Rumah Bagus Siap Huni Pinggir Jalan 2 Mbl Asem Baris Tebet,2300,130,150,4,1,0,Murah
Rumah siap huni lokasi strategis pinggir jalan raya asem baris jaksel,2000,120,94,2,2,0,Murah
Rumah Tua Dalam Lingkungan Yang Nyaman Di Kebon Baru Jakarta Selatan,2250,130,150,2,1,0,Murah
"Dijual rumah di Asem baris, Akses jalan 2 mobil",2000,100,111,2,2,1,Murah
Rumah baru siap huni di tebet barat,4000,216,135,5,4,2,Menengah
TEBET RAYA Rumah Layak Huni Dekan Stasiun,22000,350,448,6,7,2,Mahal
Dijual Rumah Komplek Tebet Lokasi Premium Tenang Jalan Lebar,13000,216,384,3,3,2,Mahal
Dijual Cepat Rumah Di Tebet Dalam,9000,470,353,9,6,0,Mahal
Rumah Baru Model Minimalis Di Tebet Timur Jakarta Selatan,6200,260,138,6,5,0,Mahal
"Dijual Rumah Lama Hitung Tanah Di Tebet Jaksel, Lokasi TOP, Tenang, Asri",2400,120,149,3,2,0,Murah
TEBET RAYA Jalan Lebar Cocok Untuk Resto dan Kantor,15000,237,387,5,4,3,Mahal
TEBET RAYA AREA KOMERSIL Rumah Siap Huni Bisa Dibangun 4 Lantai,22000,300,520,4,4,2,Mahal
"3 Bedrooms House Tebet, Jakarta Selatan, DKI Jakarta",2200,120,100,3,2,1,Murah
"Jual Rumah Tebet 3-Lantai Akses 2 Mobil, Jakarta Selatan",5000,320,150,9,5,0,Menengah
Rumah Second Terawat Dan Setrategis Tebet Jakarta Selatan,23000,350,565,5,3,4,Mahal
Rumah tebet dekat mall kokas,2700,135,87,3,2,2,Murah
Rumah Baru di Jln Tebet Timur Jakarta Selatan,4595,170,136,5,4,2,Menengah
"Dijual Rumah di Jalan Palbatu, dekat kota kasablanka, jalan 2 mobil",1300,100,75,3,2,0,Murah
"Dijual Cepat Rumah Hoek Tebet, jalan 2 mobil Harga Nego",12000,500,590,10,10,0,Mahal
"Dijual Rumah 1,5 Lantai Di Tebet Dalam",21000,300,500,4,3,4,Mahal
"Dijual Cepat Rumah Bagus di Tebet, Siap huni",3500,170,100,5,3,3,Menengah
"Dijual Rumah Baru di Tebet, Elite",3900,179,142,5,4,2,Menengah
"Dijual Brand New Rumah Tebet, Ada Swimming Pool",25000,700,619,5,4,10,Mahal
"Dijual Rumah Baru di Tebet, Jalan 1 mobil Lebar, Jakarta Selatan",3900,179,142,5,4,2,Menengah
"Dijual Rumah Elite di Tebet, Jakarta Selatan",1250,480,312,4,2,1,Murah
"Dijual Rumah Baru di Tebet, siap huni",3900,230,130,3,4,3,Menengah
"Dijual Rumah Tebet Barat, Hitung Tanah Saja, Jarang Ada",3000,150,160,5,2,0,Murah
Dijual Rumah Cantik Tebet Lokasi Premium Nyaman Jalan Lebar,12000,240,303,6,6,4,Mahal
Rumah Nyaman Jalan Lebar Strategis Di Kebon Baru Dekat Stasiun Tebet,5000,275,210,6,5,3,Menengah
Rumah 2 Lantai Luas Murah Strategis Di Kebon Baru Dekat Stasiun Tebet,2300,150,132,4,3,1,Murah
Dijual Rumah Strategis Komplek Gudang Peluru Jakarta Selatan,9800,162,342,5,3,2,Mahal
Rumah Murah Di Tebet Jaksel,6800,500,428,5,4,4,Mahal
"Rumah 2 Lantai Di Tebet Barat, Blakang Perkantoran Mt Haryono",11000,600,391,7,5,4,Mahal
"Rumah Di Pinggir Jalan Tebet Barat Raya, SHM, Investasi Bagus",11500,350,400,9,7,6,Mahal
Dijual Cepat Rumah Tebet Barat Dalam Lokasi Strategis Jakarta Selatan,3600,130,163,3,2,2,Menengah
"Rumah Tebet Bebas banjir, dekat pintu tol",22500,700,610,6,4,1,Mahal
Rumah Mewah Dan Sangat Strategis Di Tebet,9500,340,240,7,4,2,Mahal
"Tebet Mas, lokasi OK depan taman",13000,225,322,4,3,2,Mahal
Rumah TEBET jak sel,10000,300,264,5,4,0,Mahal
Rumah berada di kawasan elit di @Tebet Timur,5500,117,205,5,4,0,Mahal
Rumah Di tebet Barat,3500,90,110,3,3,1,Menengah
Rumah di tebet,3500,250,91,4,2,2,Menengah
Rumah Murah Di Tebet Jakarta Selatan Baru ,3800,154,113,4,4,3,Menengah
Rumah Siap Huni Di Tebet Lokasi Sangat Strategis Sekali,2800,250,90,3,3,1,Murah
Dijual Rumah Mewah Terawat Di Daerah Tebet Hrg Menarik,13750,600,429,6,4,1,Mahal
Rumah Baru Tebet,6200,220,150,4,4,2,Mahal
"Dijual Rumah Asri, Tebet, Jakarta Selatan",4600,200,147,4,3,1,Menengah
Rumah Lama di tebet berada di pusat kota jakarta selatan,12000,322,322,4,3,2,Mahal
di jual rumah bagus tebet,2500,94,78,2,2,2,Murah
Rumah Lama Tebet Dijual Cepet Dengan Lokasi Strategis,2500,160,135,3,2,2,Murah
Rumah Besar Bangunan Kokoh Siap Huni Di Kebon Baru Tebet Jak Sel,9200,450,700,8,4,2,Mahal
Dijual rumah hitung tanah di tebet dalam komplek jalan lebar,6500,217,217,3,2,2,Mahal
Rumah Siap Huni Dan Bagus Dijual Kebon Baru Tebet Jakarta Selatan,12000,450,700,8,4,0,Mahal
Rumah Siap Huni Dijual Jaya Mandala Jakarta Selatan,35000,599,469,4,3,0,Mahal
"Rumah Di Tebet Timur, Jalan 1 Mobil, Dekat 2 mobil",4200,120,143,6,3,2,Menengah
"Rumah Di Tebet Barat Dalam, Jalan 2 Mobil, Strategis",5500,200,221,5,2,2,Mahal
"Tebet rumah minimalis modern akses 2 mobil, jakarta selatan",3500,190,100,6,4,2,Menengah
Rumah gang kebun baru tebet jakarta selatan,900,100,56,3,2,0,Murah
Rumah Dijual di Tebet Jakarta Selatan,3500,350,100,4,4,2,Menengah
Rumah murah dan strategis di tebet timur jakarta selatan,7500,150,288,5,3,1,Mahal
Rumah dua lantai di Tebet Barat Dalam Jakarta Selatan,3500,235,140,5,4,2,Menengah
Rumah Jakarta Selatan Tebet,14000,200,475,5,3,0,Mahal
"Rumah Siap Huni LT 170 M2 TERMURAH di Tebet Dalam, Jakarta Selatan",3500,210,170,6,2,2,Menengah
Newly House dekat Taman Akses JALAN 2 MOBIl bentuk tanah NGANTONG di Tebet Barat,4950,225,110,5,4,2,Menengah
Rumah Cantik 3 Lt Semi FURNISH di Tebet Utara,2600,210,91,5,3,1,Murah
Dijual Rumah Baru Di Tebet Timur Harga Bagus,4200,200,165,4,2,0,Menengah
Rumah Arsitektur Klasik Dijual Di Tebet Barat Harga Bagus,4200,150,100,4,4,0,Menengah
Dijual Rumah 3 Lantai Cocok Untuk Tempat Tinggal Dan Usaha Kost,1300,332,125,7,7,0,Murah
Rumah siap huni di Tebet - RPA,8500,550,440,8,5,5,Mahal
Brand New Rumah Soho Tebet,8750,180,137,4,4,2,Mahal
"Rumah Brand New Siap Huni Tebet Timur Dalam, Dekat Pspt",3900,200,130,3,3,1,Menengah
Di jual rumah siap huni model classic di tebet menteng dalem jakarta selatan,6100,390,130,7,6,3,Mahal
Rumah Cantik Tebet Jaksel. Dekat Cbd Kuningan Dan Mal Kokas,2500,150,90,3,2,1,Murah
Dijual Rumah Siap Huni di Tebet Jakarta Selatan,3500,350,100,4,4,2,Menengah
"Rumah Klasik SUPER MEWAH Semi Furnished Tebet Timur, Jakarta Selatan",30900,1000,670,8,6,4,Mahal
"Rumah Tua HITUNG TANAH TERMURAH di Area Komersial Jl. Johar, Menteng",55000,400,1075,4,3,4,Mahal
"Rumah Tua Strategis Dijual Hitung Tanah Di Tebet, Jakarta Selatan",3500,225,360,4,2,1,Menengah
Dekat Rumah Sakit Tebet Dan Gelael,3500,200,145,8,8,3,Menengah
TEBET Rumah Jual Hitung Tanah Jalan Tiga Mobil Lebar,4500,150,200,3,2,2,Menengah
"Rumah Lama Di Prime Area Tebet, Komersial",55000,1126,1224,4,4,2,Mahal
Rumah Di Area Komersial Tebet Raya,22000,300,520,4,4,3,Mahal
"Rumah Cantik Brand New, Tersisa 2 Unit",3200,150,86,5,4,2,Murah
"TEBET - Rumah Baru, Design Menarik di Tengah Kota Jakarta",6500,300,173,4,4,2,Mahal
"Rumah di Tebet Timur Jalan 1 Mobil Lebar, Luas Tanah 135 m2",1900,130,135,5,2,1,Murah
"TEBET - Sangat Terawat, Area Tenang di Depan Taman",5990,350,220,5,5,2,Mahal
"DIJUAL Cepat Rumah Baru Siap Huni Full Furnish, Tebet Barat",5500,300,173,4,4,2,Mahal
"Tebet rumah mewah prime lokasi, jakarta selatan",16500,800,361,7,5,6,Mahal
Rumah luas kolam renang di Tebet Jakarta Selatan,23000,700,619,5,5,10,Mahal
Rumah jual tebet jl 2mobil 4. 5mly,4499,250,140,5,4,2,Menengah
Dijual Rumah Tebet Barat Lokasi Premium Tenang Jalan 1 Mobil,3500,150,135,3,3,2,Menengah
Dijual Rumah Baru Siap Huni Depan Taman Tebet,6000,220,150,4,4,2,Mahal
"Rumah baru 100%, Tebet, Jakarta Selatan",3600,154,110,3,3,2,Menengah
"4 Bedrooms House Tebet, Jakarta Selatan, DKI Jakarta",4300,180,135,4,4,2,Menengah
TEBET Rumah Mewah Terawat Dekat Jalan Soepomo,7900,380,225,5,4,2,Mahal
Dijual Rumah Di Asem Barus Tebet,27000,350,1069,4,4,5,Mahal
"Dijual Rumah Di Barat Asem Baris,Kebun Baru",5000,320,150,5,5,3,Menengah
Dijual Rumah Di Tebet Barat,3000,110,132,3,2,0,Murah
Rumah Didalam Kompleks Tebet,4900,280,170,5,4,3,Menengah
Dijual Rumah Tebet Depan Taman Asri Jalan Muat 2 Mobil,3700,130,130,3,3,2,Menengah
Rumah Tebet Asam Baris,2900,160,160,3,3,1,Murah
Rumah Tebet Barat,3700,175,89,3,3,2,Menengah
Dijual Rumah Hitung Tanah Tebet Timur Lokasi Strategis Jalan 1 Mobil,3600,100,180,4,2,1,Menengah
Dijual Rumah Hitung Tanah Tebet Utara IV,2333,80,90,2,2,1,Murah
Rumah Mewah Brand New Di Menteng Dalam Tebet Jakarta Selatan,25000,890,271,5,6,3,Mahal
"TEBET - Rumah Bagus, Jalan 1 Mobil, Siap Huni",6500,275,150,4,5,1,Mahal
"TEBET - RUMAH BARU, Design Bagus",6500,270,140,3,3,4,Mahal
"Tebet-Area Komersi, Jalan 3 Mobil Lebar",22000,300,520,5,4,3,Mahal
"TEBET - SIAP HUNI, Jalan 1 Mobil",2850,102,96,3,2,2,Murah
"TEBET - RUMAH BARU, Jalan 3 Mobil Lebar",30000,900,672,5,6,4,Mahal
rumah second tebet,25000,350,565,4,4,4,Mahal
Rumah Dijual Daerah Bukit Duri Jakarta Selatan,1250,120,136,5,2,0,Murah
Rumah Hitung Tanah Di Gudang Peluru,4000,194,194,3,3,1,Menengah
Dijual Rmh Secont Tebet,6000,250,141,4,4,3,Mahal
"Rumah Dekat Pusat Kota Selangkah Menuju Terminal Kampung Melayu, Stasiun Tebet Dan Kota Casablanca",2600,147,154,4,3,1,Murah
Dijual Rumah siap huni baru di tebet barat V,3500,126,135,4,3,0,Menengah
Rumah baru 2 lantai di Tebet timur,3500,170,112,3,4,2,Menengah
Di Jual Rmh Tbt Siap Huni,12500,600,208,4,5,3,Mahal
Rumah bagus dekat taman dan pasar pspt siap huni acces mudah kemana saja,3950,260,133,5,5,2,Menengah
Rumah Tebet Timur Dalam,2300,100,140,3,2,1,Murah
Jual Rumah 2 Lantai Di Tebet Jakarta Selatan,4000,216,135,5,4,1,Menengah
Rumah Mewah Siap huni Tebet,29000,900,672,5,6,4,Mahal
"For Sale British Tuscan House At Tebet Mas, Jaksel",37000,500,720,5,5,2,Mahal
Hunian Nyaman Di Gudang Peluru,8000,382,404,6,3,1,Mahal
"Rumah Siap Huni 2 Lantai,Lokasi Strategis Menteng Dalam Tebet Jaksel",5000,180,127,4,4,2,Menengah
TEBET Rumah Lama Hitung Tanah Bangunan Masih Layak Huni,7200,200,256,5,3,2,Mahal
Rumah Mewah Dijual Tebet Jakarta Selatan,17500,800,365,5,4,6,Mahal
Dijual rumah mewah tebet barat,14800,500,310,4,4,4,Mahal
Rumah Tebet segera jual,3750,196,196,7,5,2,Menengah
Rumah Baru Lux siap huni strategis di Menteng Dalam Tebet Jakarta Selatan,6200,390,130,7,6,3,Mahal
"5 Bedrooms House Tebet, Jakarta Selatan, DKI Jakarta",4000,200,160,5,4,2,Menengah
"Tebet Barat Rumah Full Furnished, Jakarta Selatan",6200,251,140,5,4,5,Mahal
Dijual Rumah Pinggir Jalan Di Asem Baris Tebet Jakarta Selatan,8000,252,200,4,3,2,Mahal
Dijual Rumah Mewah Lokasi Strategis Di Tebet Barat Jakarta Selatan,8800,400,230,5,5,3,Mahal
Rumah Siap Huni Di Tebet Jakarta Selatan,3200,150,80,5,5,1,Murah
Dijual Rumah Tebet Raya Lokasi Premium Area Komersial Jalan Raya,18500,300,520,4,3,3,Mahal
TEBET TIMUR - RUMAH MEWAH CLASSIC MODERN,18500,800,361,5,4,4,Mahal
"Dijual Rumah Tua Hitung Tanah di Tebet, Jakarta Selatan",2250,135,135,4,4,0,Murah
Dijual Rumah Lux Tebet Jakarta Selatan,16000,140,246,6,6,1,Mahal
"Rumah Jual Hitung Tanah, Tebet Timur",5999,240,240,4,4,3,Mahal
Rumah Dijual Hitung Tanah Di Tebet Barat,8555,304,304,3,2,3,Mahal
"TEBET - Rumah Bagus, Terawat, Dekat ke Kuningan",4600,215,135,9,8,2,Menengah
TEBET - Siap Huni,4700,222,145,4,3,2,Menengah
Dijual Rumah Siap Huni BU di Kebon Baru Tebet Jakarta Timur,2500,165,135,4,3,1,Murah
Dijual Rumah Cantik Tebet Lokasi Premium Nyaman Jalan 2 Mobil,8500,260,256,4,3,4,Mahal
"Rumah Jl. Rasamala Menteng Dalam, Hitung Tanah",5100,200,305,5,2,3,Mahal
Dijual rumah second Tebet Jakarta Selatan berada dalam lingkungan aman,8000,330,240,5,5,3,Mahal
Dijual Rumah Di Kebon Baru Tebet,3975,325,226,6,5,1,Menengah
Rumah tebet timur dalam,5800,340,173,5,4,2,Mahal
Rumah Mewah Siap Huni Di Tebet,5500,420,210,6,5,2,Mahal
Rumah Asri Dan Sangat Strategis Di Tebet,4500,120,154,6,4,1,Menengah
Rumah Tebet utara,2700,94,78,3,2,1,Murah
Rumah Second Fully Furnish Siap Huni Turun Harga BU Di Menteng Dalam Tebet Jakarta Selatan,4300,180,127,4,4,2,Menengah
Dijual Rumah Minimalist Modern 3lnt Tebet,3700,150,90,4,4,3,Menengah
Dijual Rumah 2 Lnt Tebet,3800,200,130,4,4,2,Menengah
Dijual rumah kos tebet,2600,200,135,10,3,2,Murah
Dijual Rumah Kondisi Layak Huni Tebet,4200,400,225,5,4,2,Menengah
Rumah Tua Hitung Tanah Tebet,3600,200,186,3,2,0,Menengah
Rumah Tua hitung Tanah Tebet,2150,100,104,2,1,0,Murah
Tebet Timur Area Tenang dan Nyaman,2600,120,90,3,2,1,Murah
Rumah Siap Huni Tebet Barat,22000,400,650,7,4,4,Mahal
Rumah Mewah di Tenet,8300,260,306,4,3,1,Mahal
TERJUAL TEBET Rumah Terawat Siap Huni Dekat dari Jalan Besar,2990,162,156,5,4,2,Murah
TEBET Rumah Siap Huni Buatan Arsitek,3200,160,90,3,3,2,Murah
TEBET Rumah Siap Huni Buatan Arsitek,2800,150,90,4,3,2,Murah
Rumah Di Tebet Lokasi Strategis,7500,350,250,5,4,1,Mahal
Rumah di Tebet Hanya 200 m dari MT Haryono,6000,295,352,6,4,5,Mahal
Rumah Di Tebet Lingkungan Mewah Dan Akses Mudah,13500,400,430,9,4,4,Mahal
Rumah Nyaman Asambaris Tebet,5000,320,150,7,6,2,Menengah
"Rumah Dijual 2 lantai, kebon baru Tebet Jak sel",6800,500,428,6,4,5,Mahal
"Rumah tebet timur jakarta selatan. cozy style modern mini custler 4, 6M",4600,176,137,5,4,2,Menengah
Di Jual Rumah Second Lokasi Strategis Tebet Jakarta Selatan,7000,300,182,4,3,2,Mahal
"Tebet rumah modern classic, jakarta selatan",3500,400,150,5,4,2,Menengah
"Rumah tebet dalam, jalan 3 mobil, lingkungan tenang, nego",35000,1000,1400,10,7,7,Mahal
Dijual rumah cantik bagus di Daerah Menteng Tebet,5300,195,199,5,2,1,Mahal
Dijual rumah baru cantik minimalis di Tebet,4000,216,135,5,4,1,Menengah
Dijual Rumah Siap Huni 1.5 Lnt,3500,190,135,4,3,2,Menengah
Rumah Strategis di Tebet dekat Terminal Kampung Melayu,2400,147,154,2,2,0,Murah
"Rumah Minimalist Dijual Di Kebon Baru, Tebet, Jakarta",3375,192,120,5,4,2,Menengah
Dijual Rumah Siap Huni DI Tebet Jaksel,15000,350,400,7,4,3,Mahal
Rumah Siap Huni Dijual Tebet Barat Tebet Jakarta Selatan,22000,300,405,4,4,0,Mahal
"Tebet Timur Jalan lebar, dekat statiun, harga bagus",14000,400,541,5,5,4,Mahal
Rumah mewah dijual di Tebet Jakarta selatan,23000,750,610,6,4,4,Mahal
"Rumah Hitung Tanah di Tebet Timur, Jalan Lebar 3 Mobil, Bentuk Tanah Persegi",7100,200,256,6,3,3,Mahal
Rumah second masih bagus wilayah Tebet,6000,325,222,6,4,1,Mahal
TERJUAL TEBET TIMUR JALAN 2 MOBIL Dekat Taman,4300,200,145,3,3,2,Menengah
Dijual Rumah Cantik Tebet Barat Lokasi Dekat Taman Nyaman Jalan 1 Mobil,3500,250,90,3,4,2,Menengah
Very Cheap House Tebet,6500,219,338,5,3,1,Mahal
"Tebet rumah full furnished, jakarta selatan",7000,210,166,6,6,3,Mahal
"The Classic Luxury House With Pool @Brand New near Cassablanca Area, Palbatu, Jakarta Selatan",6100,375,130,6,5,3,Mahal
"The Classic Luxury House With Pool @Brand New near Cassablanca Area, Palbatu, Jakarta Selatan",4000,200,160,5,4,2,Menengah
Rumah siap huni di tebet dalam,8000,470,350,7,6,2,Mahal
Rumah Tua Kebon Baru Tebet Jakarta Selatan,10000,674,775,4,3,0,Mahal
Rumah Tebet Ada Kamar Tidur,3700,400,370,6,2,0,Menengah
Rumah Area Tebet Ada Kamar Tidur,3000,192,120,4,3,2,Murah
Dijual Rumah Gudang Peluru Tebet Lokasi Premium Nyaman Jalan Lebar,8250,460,290,6,5,2,Mahal
"Rumah di Tebet Timur Dalam 7 i, Luas Tanah 179 m2, Lebar Muka 12 meter",3300,160,179,4,2,2,Menengah
Dijual Rumah Di Tebet,11000,500,400,6,3,4,Mahal
"Dijual Rumah Baru Siap Huni Daerah Tebet , Jakarta Selatan",7000,220,166,4,4,2,Mahal
Tebet Timur Rumah Homies Termurah Cepat,2990,162,156,6,4,2,Murah
"DIJUAL Rumah 2 Lantai, Lokasi Sangat Strategis, Dekat Tol Cawang dan Stasiun Cawang",3600,125,135,5,3,2,Menengah
Dijual Murah Rumah Di Jln Keselamatan Tebet Jakarta Selatan,2650,190,202,4,2,4,Murah
Rumah Hoky Lokasi Strategis Di Belakang Hotel Haris Tebet,2650,180,202,4,2,4,Murah
Rumah 2 Lantai Siap Huni di Bilangan Tebet,2700,200,122,5,3,1,Murah
"Rumah Di Tebet Raya, Area Komersial, Keluar Ijin Domisili, Strategis",22000,500,520,5,4,4,Mahal
Rumah Tebet Dengan Lokasi Strategis Jalan Lebar,2800,150,98,4,3,1,Murah
Djual rumah di tebet jakarta selatan luas,9200,450,700,8,5,2,Mahal
Rumah jual Tebet Barat,6000,150,250,4,4,2,Mahal
"Rumah Dijual Murah Lokasi Strategis Di Kebon Baru, Tebet - Jakarta Selatan",1000,140,128,5,3,1,Murah
Brand New House At Tebet Barat,14800,500,310,3,3,4,Mahal
"Dijual Rumah Di tebet , Jakarta Selatan Cocok Untuk Ruang Usaha",7500,200,280,5,5,2,Mahal
"Tebet rumah classic cocok buat comersial, jakarta selatan",20000,700,547,6,5,6,Mahal
TEBET Rumah Nyaman Siap Huni dekat Kawasan Kuliner Tebet,1999,125,133,4,2,1,Murah
"Rumah di Tebet Timur, SHM, Dekat ke Bandara Halim, Mall Kota Kasablanka dan Dekat Pintu Tol Pancoran",1950,125,130,4,2,1,Murah
Townhouse Bidakara Mewah Nyaman Di Jakarta Selatan 4 Br,11500,600,208,4,5,4,Mahal
"Rumah hook dijual, sangat strategis di Tebet",2400,147,154,3,2,1,Murah
Rumah Cantik Full Renov Tebet Timur,3100,140,90,3,2,2,Murah
Rumah Siap Huni Di Tebet - Jakarta Selatan,4600,250,184,4,3,2,Menengah
Dijual Rumah Lama Tebet Barat Lokasi Strategis Jalan 1 Mobil,3000,140,135,3,2,1,Murah
Dijual Rumah Baru 2 lantai Di Tebet,3200,120,86,5,4,2,Murah
Rumah Asri di jalan utama tebet,15000,500,400,9,6,4,Mahal
"Rumah tebet timur dalam, depan taman",4500,140,140,3,2,1,Menengah
Dijual rumah hook asri Bangunan di gudang peluru,6800,480,290,6,3,4,Mahal
Rumah Tebet Timur Dalam Dekat Pspt dan stasiun tebet,6500,219,338,5,3,3,Mahal
Rumah lama hitung tanah kb. Baru Tebet,3550,250,352,5,1,3,Menengah
Rumah Mewah Fullfurnish Tebet Jakarta Selatan,23000,1000,498,8,9,5,Mahal
Siap Huni Depan Taman Tebet Dalam,4200,220,115,4,3,0,Menengah
Rumah Dijual Di Tebet,9000,250,162,4,3,2,Mahal
Rumah Tinggal Area Tebet,12000,385,404,4,3,0,Mahal
Rumah Mewah Di Prime Area Tebet,12000,350,198,7,5,4,Mahal
Rumah Tua Hitung Tanah Di Prime Area. TERMURAH Di TEBET !,22000,600,852,5,5,4,Mahal
Rumah Bagus Siap Huni Dekat Casablanca. TERMURAH Di TEBET !,3500,300,190,6,6,3,Menengah
Rumah Siap Huni Dan Tanah Kosong  Tebet Barat,15000,200,385,5,5,0,Mahal
Rumah Lama Di Tebet. MURAH. Best Investment !,3850,160,224,4,3,1,Menengah
Komplek Bukit Duri Permai,9800,759,319,4,4,4,Mahal
Rumah Bagus Siap Huni JUAL CEPAT ! Tebet Utara,8900,300,300,5,4,2,Mahal
Rumah Cantik Siap Huni Dalam Komplek. JUAL CEPAT ! Tebet Barat ,4700,280,102,4,3,3,Menengah
Rumah Baru Siap Huni. MURAH ! Tebet Barat,3050,173,89,3,4,2,Murah
Rumah Bagus Siap Huni FULL FURNISHED Di Dalam Komplek Tebet Barat,5750,250,121,4,4,2,Mahal
Rumah Baru Dalam Komplek Tebet,4500,250,110,4,3,1,Menengah
RUMAH MEWAH TEBET,28000,750,498,5,5,3,Mahal
Rumah Tebet 2 lantai,6500,117,205,5,4,0,Mahal
Rumah tebet ada ruang usaha jakarta selatan,13000,500,400,6,3,2,Mahal
Rumah Mewah Cantik Minimalis Modern Harga Dibawah Pasaran di Jalan Raya Tebet Timur Dalam Raya Tebet,25000,350,565,5,5,1,Mahal
good unit house tebet jakarta,7300,500,325,5,5,1,Mahal
"Rumah Tebet Timur, Jalan 1 Mobil",2900,125,135,5,2,1,Murah
